Competitor,Website,Phone,Email,Primary Address,Service Area / Locations,Observed SEO/Google signals,Notable positioning / offers,Notes / potential weaknesses
ProWest Roofing,prowest.com,(602) 738-7663,sales@prowest.com (site footer also shows info@prowest.com),"Multiple offices noted: Gilbert (1715 W Sunrise Blvd, Gilbert, AZ 85233) and Mesa (724 W University Dr #104, Mesa, AZ 85201)","Phoenix metro + multiple AZ cities (Phoenix, Gilbert, Mesa, Tempe, Scottsdale, Glendale, Tucson, Flagstaff, etc.)",Location pages; News/Blog; Financing; Insurance inspection CTA; NAP in footer; map link present; claims 5-star/350+ Google reviews,Free estimate; insurance claim assistance; restoration/remodel; financing,Multiple 'ProWest' branded domains exist in AZ—monitor brand/market overlap to avoid misattribution.
Mission Restoration,missionrestoration.com,+1 (800) 339-6762,Not clearly listed on contact page (phone-first),"Phoenix location listed as 2848 N Omaha, Mesa, AZ 85215","Multi-location: AZ (Phoenix/Mesa, Prescott Valley, Tucson, Flagstaff), plus CO and CA locations",Dedicated locations hub; service-type navigation (Residential/Commercial/Insurance Claims/Water Mitigation); blog; strong on-site internal linking; NAP on locations page; links to social profiles,Scheduling flow; insurance claims assistance; water mitigation (beyond roofing),Phone-first tracking; multi-state brand may dilute hyper-local messaging vs single-market roofers.
HailCo Roofing,hailcoroofing.com,(480) 582-3122,info@hailcoroofing.com,"7655 E Redfield Rd Ste 130, Scottsdale, AZ 85260","Service-area pages for Phoenix, Scottsdale, Tucson, Tempe, Mesa, Chandler, Glendale, Gilbert, Flagstaff, Prescott",Robust service-area page framework; blog; “share.google”/Maps links; strong storm/insurance content; NAP in footer,Free quote; emergency roofing; storm damage assessment; insurance claim support,Heavy emphasis on service-area pages—ensure uniqueness/avoid thin content if competing.
United Roofing & Restoration,unitedroofingarizona.com,(928) 412-9467,Not obvious on homepage snippet,"790 N. Lake Havasu Ave. #10, Lake Havasu City, AZ 86403",Targets Greater Phoenix via dedicated page; also statewide positioning from a Lake Havasu base,"Service + roofing-system pages (e.g., EPDM/TPO); local landing page for Greater Phoenix; clear phone CTA",Free estimates; guaranteed language; residential + commercial + emergency,Primary office outside Phoenix metro may be a perception gap for some Phoenix customers.
United Contracting Group (United Roofing + General Contracting),unitedcontractinggroup.com,602.962.8578 (site) / 602-806-7663 (directory listing),Not listed in snippet,Scottsdale-based (exact street address not captured in snippets),Statewide / multiple AZ cities including Phoenix (per site language),Modern site with dedicated service pages (installation/repair); strong speed/response positioning; prominent scheduling CTAs,“Onsite statewide in 24 hours”; free inspection scheduling,Phone-number variance across sources suggests potential NAP consistency risk.
Aspire Contracting & Roofing,aspirecontractingandroofing.com,(480) 566-7180 (site footer) / (480) 318-7870 (contact page),office@aspirecontractingandroofing.com (site footer) / info@aspirecontractingandroofing.com (contact page),"5025 S Ash Ave. #13, Tempe, AZ 85282 (site footer) / 408 S Rockford Dr, Tempe, AZ 85281 (contact page)",Phoenix metro (Tempe base),"Service pages (shingle, tile, flat, etc.); blog; clear NAP on contact page; portfolio/gallery sections",Free inspections/estimates; breadth of roof types,Needs strong location-page depth to compete with heavy city-page competitors.
Blackstone Roofing Group,blackstoneroofinggroup.com,(602) 536-9363 (site/BBB) / (602) 399-3801 (GAF listing),Contact form + 'Email Business' (no public email shown on homepage snippet),"Peoria, AZ 85382 (GAF lists 8742 W Deer Valley Rd, Peoria AZ 85382)",Service-area menu includes Phoenix/Scottsdale/Paradise Valley + East/West Valley cities + Northern AZ,Service-area architecture in nav; residential/commercial/insurance restoration pages; BBB accreditation; social links,Free comprehensive inspections; relationship-driven messaging; insurance restoration,Potential NAP/phone inconsistency across site vs directory sources—worth validating for GBP alignment.
Titan Roofing,titanroofingaz.com,602.300.0177,Not visible in snippet,"Mesa office: 928 N. Val Vista Drive #114, Mesa, AZ 85205; Tucson office: 350 N. Wilmot Road Suite 110, Tucson, AZ 85711",Phoenix metro + Tucson,Multi-location contact page; strong 'contractors in Arizona' branding; likely service pages for roof types,Multi-city coverage; strong brand claim (#1 contractors),Ensure local city pages are robust; otherwise may rely on brand + paid channels.
Pinnacle Roofing,pinnacleroofingaz.com,(623) 792-5497,office@pinnacleroofingaz.com,"1518 W Knudsen Dr Suite 100, Phoenix, AZ 85027 (ARCA listing)",Greater Phoenix,Modern site; clear conversion CTAs; contact page with email/phone; likely city/service pages,Free estimate; broad material coverage (tile/foam/metal/shingle),Address should be validated against GBP; Webflow sites sometimes underuse technical SEO defaults without intentional setup.
State 48 Roofing,state48roofing.com,(480) 268-4509 / (480) 698-4828 (site); (602) 309-1591 (GAF),info@state48roofing.com,"1381 N Pioneer St, Gilbert, AZ 85233 (GAF listing)",Residential + commercial across AZ; strong East Valley footprint,High-CTA homepage; social presence; licensing/ROC displayed; directory listings (GAF),Free quote; complimentary inspections; strong brand language,Multiple phone numbers across sources—ensure NAP consistency and call tracking doesn’t fragment citations.
Next Gen Coating & Roofing Systems,nextgen-az.com,(602) 908-4210,Sales@thenextgenaz.com (privacy policy),"4014 E Broadway Rd Suite 406, Phoenix, AZ 85040",Phoenix metro,Service pages targeting Phoenix keywords; contact page with address; blog categories; storm-damage + after-hours restoration tie-in,Free inspection; emergency roof repair (after-hours via restoration line); coatings + repairs,Brand split across roofing vs restoration domains—ensure cross-domain tracking/SEO equity is consolidated.
Arizona Roof Rescue,arizonaroofrescue.com,(602) 242-2706,info@arizonaroofrescue.com,"8646 W Glendale Ave, Glendale, AZ 85305",Phoenix metro (Glendale base),Older-domain advantage; straightforward contact page with NAP; likely long-tail authority from longevity,Traditional contractor positioning; direct phone + office hours,Older site UX may under-convert vs modern competitors; technical SEO refresh could be needed.
BUILTRoofing AZ,builtroofingaz.com,(480) 207-0059,jakep@builtroofingaz.com,"Gilbert, AZ (no street address in snippet)","Gilbert + surrounding East Valley; service-area pages (Gilbert, Queen Creek, etc.)",Service-area pages + articles/blog; NAP elements visible; strong CTA framing (free inspections),Free inspection; honest/upfront estimates,"No full address visible in snippet; if missing on-site, could weaken local signals."
Weather-Tech Roofing,weathertechroofingaz.com,(480) 848-3486,weathertechroofingaz@gmail.com,Chandler/Gilbert area (BBB lists Chandler; Phoenix page is service-area content),"Phoenix metro (city pages, incl. Phoenix)","City pages (e.g., /phoenix/); contact page with phone/email; multi-generation trust story; likely targeting local-intent keywords",Free consultation/estimate; emergency repairs,"Gmail address can look less enterprise; ensure trust signals (licenses, certifications) are prominent."
